{
    "name": "aodv",
    "repo_url": "https://github.com/ZNetLink/ms-model-aodv",
    "author": {
        "name": "ZNetLink",
        "email": "jiazequn@znetlink.com"
    },
    "description": "MANET自组网AODV路由模型",
    "labels": [
        "Routing",
        "路由协议"
    ],
    "license": "GPL-3.0",
    "versions": [
        {
            "version": "0.1.3",
            "checksum": "sha256:3e6a8f477b6c6b08d9e43efeed1766d9a4206f7265e42a26db17caa0525ac0c0",
            "url": "https://github.com/ZNetLink/ms-model-aodv/releases/download/v0.1.3/source-code-v0.1.3.zip",
            "date": "2025-12-04",
            "notes": "修复发送时延模型配置错误"
        },
        {
            "version": "0.2.0",
            "checksum": "sha256:9e436c115146dc9ed3d591d1040be4b87cded7fba2f474084825e27c07b3e265",
            "url": "https://github.com/ZNetLink/ms-model-aodv/releases/download/v0.2.0/source-code-v0.2.0.zip",
            "date": "2025-12-12",
            "notes": "支持v2新版进程模型"
        }
    ]
}
