{
    "name": "通用无线MAC层模型",
    "repo_url": "https://github.com/znetlink/ms-model-generic-wireless",
    "author": {
        "name": "ZNetLink",
        "email": "jiazequn@znetlink.com"
    },
    "description": "通用无线MAC层模型，在不关心MAC层具体实现的情况下，可以使用此模型进行模拟MAC层提供的通信能力。",
    "labels": [
        "MAC"
    ],
    "license": "GPL-3.0",
    "versions": [
        {
            "version": "0.1.0",
            "checksum": "sha256:40eb65fb73c67982cb41f6b3efc2228722044fdba87a6cf5142e33b2eb0471e1",
            "url": "https://github.com/ZNetLink/ms-model-generic-wireless/archive/refs/tags/v0.1.0.zip",
            "date": "2025-11-19",
            "notes": "Initial release."
        }
    ]
}
