{
    "name": "UDP模型",
    "repo_url": "https://github.com/ZNetLink/ms-model-udp",
    "author": {
        "name": "ZNetLink",
        "email": "jiazequn@znetlink.com"
    },
    "description": "基础UDP模型",
    "labels": [
        "Transport",
        "传输层"
    ],
    "license": "GPL-3.0",
    "versions": [
        {
            "version": "0.1.1",
            "checksum": "sha256:d2f523751bef552335933fbf24dc193d33a0c43ee01d704ff44b7be8da91bc71",
            "url": "https://github.com/ZNetLink/ms-model-udp/releases/download/v0.1.1/source-code-v0.1.1.zip",
            "date": "2025-11-21",
            "notes": "修复注解问题."
        }
    ]
}
