{
    "name": "echo-app",
    "repo_url": "https://github.com/znetlink/ms-model-echo-app",
    "author": {
        "name": "ZNetLink",
        "email": "jiazequn@znetlink.com"
    },
    "description": "智网妙算回显应用模型",
    "labels": [
        "App",
        "应用层"
    ],
    "license": "GPL-3.0",
    "versions": [
        {
            "version": "0.1.1",
            "checksum": "sha256:6033df42e0253b692004452633bce9ccf9fe31cbae1ecd0fde1298d48cce8823",
            "url": "https://github.com/ZNetLink/ms-model-echo-app/releases/download/v0.1.1/source-code-v0.1.1.zip",
            "date": "2025-11-22",
            "notes": "Fix code error."
        }
    ]
}
